{
	"final_summary" : "\nabstract_factory:\nWindowsOSFactory acts as a factory for GUIFactory, which overrides createButton method of GUIFactory, createCheckBox method of GUIFactory. It is a public class that implements GUIFactory. The 2 methods of WindowsOSFactory are createButton (Button) and createCheckBox (CheckBox). No methods call createButton and createButton calls no methods. No methods call createCheckBox and createCheckBox calls no methods.\n\nWindowsButton acts as a product for GUIFactory, which overrides paint method of Button. It is a public class that implements Button. The only method of WindowsButton is paint (void). No methods call paint and paint calls no methods.\n\nTest does not have any design pattern.  It is a public class. The only method of Test is main (void). No methods call main and main calls no methods.\n\nButton acts as an abstract product for Button, which is inherited by WindowsButton, MacOSButton. It is a public interface. The only method of Button is paint (void). No methods call paint and paint calls no methods.\n\nCheckBox acts as an abstract product for CheckBox, which is inherited by WindowsCheckBox, MacOSCheckBox. It is a public interface. The only method of CheckBox is paint (void). No methods call paint and paint calls no methods.\n\nMacOSFactory acts as a factory for GUIFactory, which overrides createButton method of GUIFactory, createCheckBox method of GUIFactory. It is a public class that implements GUIFactory. The 2 methods of MacOSFactory are createButton (Button) and createCheckBox (CheckBox). No methods call createButton and createButton calls no methods. No methods call createCheckBox and createCheckBox calls no methods.\n\nMacOSButton acts as a product for GUIFactory, which overrides paint method of Button. It is a public class that implements Button. The only method of MacOSButton is paint (void). No methods call paint and paint calls no methods.\n\nWindowsCheckBox acts as a product for GUIFactory, which overrides paint method of CheckBox. It is a public class that implements CheckBox. The only method of WindowsCheckBox is paint (void). No methods call paint and paint calls no methods.\n\nApplication does not have any design pattern.  It is a public class. The only method of Application is paint (void). No methods call paint and paint calls no methods.\n\nMacOSCheckBox acts as a product for GUIFactory, which overrides paint method of CheckBox. It is a public class that implements CheckBox. The only method of MacOSCheckBox is paint (void). No methods call paint and paint calls no methods.\n\nGUIFactory acts as an abstract factory for Button, CheckBox, which is inherited by WindowsOSFactory, MacOSFactory. It is a public interface. The 2 methods of GUIFactory are createButton (Button) and createCheckBox (CheckBox). No methods call createButton and createButton calls no methods. No methods call createCheckBox and createCheckBox calls no methods.\n\n\nmemento:\nWindowsOSFactory acts as an originator for memento CheckBox, which creates a CheckBox Check Box to. WindowsOSFactory acts as an originator for memento Button, which creates a Button Button to. It is a public class that implements GUIFactory. The 2 methods of WindowsOSFactory are createButton (Button) and createCheckBox (CheckBox). No methods call createButton and createButton calls no methods. No methods call createCheckBox and createCheckBox calls no methods.\n\nWindowsButton acts as a memento, which paints. It is a public class that implements Button. The only method of WindowsButton is paint (void). No methods call paint and paint calls no methods.\n\nTest does not have any design pattern.  It is a public class. The only method of Test is main (void). No methods call main and main calls no methods.\n\nButton acts as a memento, which is inherited by WindowsButton, MacOSButton, which paints. It is a public interface. The only method of Button is paint (void). No methods call paint and paint calls no methods.\n\nCheckBox acts as a memento, which is inherited by WindowsCheckBox, MacOSCheckBox, which paints. It is a public interface. The only method of CheckBox is paint (void). No methods call paint and paint calls no methods.\n\nMacOSFactory acts as an originator for memento Button, which creates a Button Button to. MacOSFactory acts as an originator for memento CheckBox, which creates a CheckBox Check Box to. It is a public class that implements GUIFactory. The 2 methods of MacOSFactory are createButton (Button) and createCheckBox (CheckBox). No methods call createButton and createButton calls no methods. No methods call createCheckBox and createCheckBox calls no methods.\n\nMacOSButton acts as a memento, which paints. It is a public class that implements Button. The only method of MacOSButton is paint (void). No methods call paint and paint calls no methods.\n\nWindowsCheckBox acts as a memento, which paints. It is a public class that implements CheckBox. The only method of WindowsCheckBox is paint (void). No methods call paint and paint calls no methods.\n\nApplication acts as a caretaker for memento CheckBox, which paints. Application acts as a caretaker for memento Button, which paints. It is a public class. The only method of Application is paint (void). No methods call paint and paint calls no methods.\n\nMacOSCheckBox acts as a memento, which paints. It is a public class that implements CheckBox. The only method of MacOSCheckBox is paint (void). No methods call paint and paint calls no methods.\n\nGUIFactory acts as an originator for memento Button, which is inherited by, which creates a Button Button to. GUIFactory acts as an originator for memento CheckBox, which is inherited by, which creates a CheckBox Check Box to. It is a public interface. The 2 methods of GUIFactory are createButton (Button) and createCheckBox (CheckBox). No methods call createButton and createButton calls no methods. No methods call createCheckBox and createCheckBox calls no methods.\n\n\nfactory_method:\nWindowsOSFactory acts as a factory method for CheckBox, which is inherited by GUIFactory, GUIFactory. It is a public class that implements GUIFactory. The 2 methods of WindowsOSFactory are createButton (Button) and createCheckBox (CheckBox). No methods call createButton and createButton calls no methods. No methods call createCheckBox and createCheckBox calls no methods.\n\nWindowsButton does not have any design pattern.  It is a public class that implements Button. The only method of WindowsButton is paint (void). No methods call paint and paint calls no methods.\n\nTest does not have any design pattern.  It is a public class. The only method of Test is main (void). No methods call main and main calls no methods.\n\nButton does not have any design pattern.  It is a public interface. The only method of Button is paint (void). No methods call paint and paint calls no methods.\n\nCheckBox acts as an abstract product for WindowsOSFactory, which is inherited by WindowsCheckBox, MacOSCheckBox. It is a public interface. The only method of CheckBox is paint (void). No methods call paint and paint calls no methods.\n\nMacOSFactory does not have any design pattern.  It is a public class that implements GUIFactory. The 2 methods of MacOSFactory are createButton (Button) and createCheckBox (CheckBox). No methods call createButton and createButton calls no methods. No methods call createCheckBox and createCheckBox calls no methods.\n\nMacOSButton does not have any design pattern.  It is a public class that implements Button. The only method of MacOSButton is paint (void). No methods call paint and paint calls no methods.\n\nWindowsCheckBox acts as a product for WindowsOSFactory, which overrides paint method of CheckBox. It is a public class that implements CheckBox. The only method of WindowsCheckBox is paint (void). No methods call paint and paint calls no methods.\n\nApplication does not have any design pattern.  It is a public class. The only method of Application is paint (void). No methods call paint and paint calls no methods.\n\nMacOSCheckBox acts as a product for WindowsOSFactory, which overrides paint method of CheckBox. It is a public class that implements CheckBox. The only method of MacOSCheckBox is paint (void). No methods call paint and paint calls no methods.\n\nGUIFactory acts as a factory for WindowsOSFactory, which overrides. It is a public interface. The 2 methods of GUIFactory are createButton (Button) and createCheckBox (CheckBox). No methods call createButton and createButton calls no methods. No methods call createCheckBox and createCheckBox calls no methods.\n\n",
	"design_pattern" : [ {
		"factory_method" : {
			"WindowsOSFactory" : {
				"concrete_product" : [ "WindowsCheckBox", "MacOSCheckBox" ],
				"abstract_product" : "CheckBox",
				"concrete_factory" : [ "GUIFactory", "GUIFactory" ]
			}
		}
	}, {
		"abstract_factory" : {
			"GUIFactory" : {
				"abstract_product" : {
					"Button" : [ "WindowsButton", "MacOSButton" ],
					"CheckBox" : [ "WindowsCheckBox", "MacOSCheckBox" ]
				},
				"concrete_factory" : [ "WindowsOSFactory", "MacOSFactory" ]
			}
		}
	}, {
		"memento" : {
			"Button" : {
				"caretaker" : {
					"Application" : [ ]
				},
				"originator" : {
					"GUIFactory" : [ "WindowsOSFactory", "MacOSFactory" ]
				},
				"concrete_memento" : [ "WindowsButton", "MacOSButton" ]
			},
			"CheckBox" : {
				"caretaker" : {
					"Application" : [ ]
				},
				"originator" : {
					"GUIFactory" : [ "WindowsOSFactory", "MacOSFactory" ]
				},
				"concrete_memento" : [ "WindowsCheckBox", "MacOSCheckBox" ]
			}
		}
	} ],
	"AbdurRKhalid-Abstract Factory" : {
		"WindowsOSFactory" : {
			"FIELDDETAIL" : [ ],
			"CLASSORINTERFACEDETAIL" : [ {
				"CLASSACCESSSPECIFIER" : "PUBLIC",
				"NUMBEROFMETHODCALLS" : 0,
				"EXTENDSFROM" : [ ],
				"IMPLEMENTSFROM" : [ "GUIFactory" ],
				"CLASSNAME" : "WindowsOSFactory",
				"ISINTERFACEORNOT" : false,
				"CLASSTYPEPARAMS" : [ ],
				"ISABSTRACTORNOT" : false,
				"CLASSMODIFIERTYPE" : [ "public" ]
			} ],
			"CONSTRUCTORDETAIL" : [ ],
			"VARIABLEDETAIL" : [ ],
			"METHODDETAIL" : [ {
				"METHODNAME" : "createButton",
				"NUMBEROFINCOMINGMETHODS" : 0,
				"INCOMINGMETHOD" : [ ],
				"METHODMODIFIERTYPE" : [ "public" ],
				"METHODBODYLINETYPE" : [ "RETURN" ],
				"NUMBEROFMETHODVARIABLES" : 0,
				"NUMBEROFOUTGOINGMETHODS" : 0,
				"METHODRETURNTYPE" : "Button",
				"METHODOVERRIDE" : [ "@Override" ],
				"OUTGOINGMETHOD" : [ ],
				"NUMBEROFMETHODLINES" : 1,
				"METHODPARAMETER" : [ ]
			}, {
				"METHODNAME" : "createCheckBox",
				"NUMBEROFINCOMINGMETHODS" : 0,
				"INCOMINGMETHOD" : [ ],
				"METHODMODIFIERTYPE" : [ "public" ],
				"METHODBODYLINETYPE" : [ "RETURN" ],
				"NUMBEROFMETHODVARIABLES" : 0,
				"NUMBEROFOUTGOINGMETHODS" : 0,
				"METHODRETURNTYPE" : "CheckBox",
				"METHODOVERRIDE" : [ "@Override" ],
				"OUTGOINGMETHOD" : [ ],
				"NUMBEROFMETHODLINES" : 1,
				"METHODPARAMETER" : [ ]
			} ]
		},
		"WindowsButton" : {
			"FIELDDETAIL" : [ ],
			"CLASSORINTERFACEDETAIL" : [ {
				"CLASSACCESSSPECIFIER" : "PUBLIC",
				"NUMBEROFMETHODCALLS" : 1,
				"EXTENDSFROM" : [ ],
				"IMPLEMENTSFROM" : [ "Button" ],
				"CLASSNAME" : "WindowsButton",
				"ISINTERFACEORNOT" : false,
				"CLASSTYPEPARAMS" : [ ],
				"ISABSTRACTORNOT" : false,
				"CLASSMODIFIERTYPE" : [ "public" ]
			} ],
			"CONSTRUCTORDETAIL" : [ ],
			"VARIABLEDETAIL" : [ ],
			"METHODDETAIL" : [ {
				"METHODNAME" : "paint",
				"NUMBEROFINCOMINGMETHODS" : 0,
				"INCOMINGMETHOD" : [ ],
				"METHODMODIFIERTYPE" : [ "public" ],
				"METHODBODYLINETYPE" : [ "EXPRESSION" ],
				"NUMBEROFMETHODVARIABLES" : 0,
				"NUMBEROFOUTGOINGMETHODS" : 1,
				"METHODRETURNTYPE" : "void",
				"METHODOVERRIDE" : [ "@Override" ],
				"OUTGOINGMETHOD" : [ ],
				"NUMBEROFMETHODLINES" : 1,
				"METHODPARAMETER" : [ ]
			} ]
		},
		"Test" : {
			"FIELDDETAIL" : [ ],
			"CLASSORINTERFACEDETAIL" : [ {
				"CLASSACCESSSPECIFIER" : "PUBLIC",
				"NUMBEROFMETHODCALLS" : 1,
				"EXTENDSFROM" : [ ],
				"IMPLEMENTSFROM" : [ ],
				"CLASSNAME" : "Test",
				"ISINTERFACEORNOT" : false,
				"CLASSTYPEPARAMS" : [ ],
				"ISABSTRACTORNOT" : false,
				"CLASSMODIFIERTYPE" : [ "public" ]
			} ],
			"CONSTRUCTORDETAIL" : [ ],
			"VARIABLEDETAIL" : [ {
				"VARIABLEDECLARATION" : [ "app" ],
				"VARIABLECOMMONTYPE" : "Application",
				"VARIABLEELEMENTTYPE" : "Application"
			}, {
				"VARIABLEDECLARATION" : [ "factory" ],
				"VARIABLECOMMONTYPE" : "GUIFactory",
				"VARIABLEELEMENTTYPE" : "GUIFactory"
			} ],
			"METHODDETAIL" : [ {
				"METHODNAME" : "main",
				"NUMBEROFINCOMINGMETHODS" : 0,
				"INCOMINGMETHOD" : [ ],
				"METHODMODIFIERTYPE" : [ "public", "static" ],
				"METHODBODYLINETYPE" : [ "EXPRESSION", "EXPRESSION", "EXPRESSION", "EXPRESSION", "EXPRESSION" ],
				"NUMBEROFMETHODVARIABLES" : 2,
				"NUMBEROFOUTGOINGMETHODS" : 1,
				"METHODRETURNTYPE" : "void",
				"METHODOVERRIDE" : [ ],
				"OUTGOINGMETHOD" : [ ],
				"NUMBEROFMETHODLINES" : 5,
				"METHODPARAMETER" : [ {
					"PARAMETERNAME" : "args",
					"PARAMETERTYPE" : "String[]"
				} ]
			} ]
		},
		"Button" : {
			"FIELDDETAIL" : [ ],
			"CLASSORINTERFACEDETAIL" : [ {
				"CLASSACCESSSPECIFIER" : "PUBLIC",
				"NUMBEROFMETHODCALLS" : 0,
				"EXTENDSFROM" : [ ],
				"IMPLEMENTSFROM" : [ ],
				"CLASSNAME" : "Button",
				"ISINTERFACEORNOT" : true,
				"CLASSTYPEPARAMS" : [ ],
				"ISABSTRACTORNOT" : false,
				"CLASSMODIFIERTYPE" : [ "public" ]
			} ],
			"CONSTRUCTORDETAIL" : [ ],
			"VARIABLEDETAIL" : [ ],
			"METHODDETAIL" : [ {
				"METHODNAME" : "paint",
				"NUMBEROFINCOMINGMETHODS" : 0,
				"INCOMINGMETHOD" : [ ],
				"METHODMODIFIERTYPE" : [ ],
				"METHODBODYLINETYPE" : [ ],
				"NUMBEROFMETHODVARIABLES" : 0,
				"NUMBEROFOUTGOINGMETHODS" : 0,
				"METHODRETURNTYPE" : "void",
				"METHODOVERRIDE" : [ ],
				"OUTGOINGMETHOD" : [ ],
				"NUMBEROFMETHODLINES" : 0,
				"METHODPARAMETER" : [ ]
			} ]
		},
		"CheckBox" : {
			"FIELDDETAIL" : [ ],
			"CLASSORINTERFACEDETAIL" : [ {
				"CLASSACCESSSPECIFIER" : "PUBLIC",
				"NUMBEROFMETHODCALLS" : 0,
				"EXTENDSFROM" : [ ],
				"IMPLEMENTSFROM" : [ ],
				"CLASSNAME" : "CheckBox",
				"ISINTERFACEORNOT" : true,
				"CLASSTYPEPARAMS" : [ ],
				"ISABSTRACTORNOT" : false,
				"CLASSMODIFIERTYPE" : [ "public" ]
			} ],
			"CONSTRUCTORDETAIL" : [ ],
			"VARIABLEDETAIL" : [ ],
			"METHODDETAIL" : [ {
				"METHODNAME" : "paint",
				"NUMBEROFINCOMINGMETHODS" : 0,
				"INCOMINGMETHOD" : [ ],
				"METHODMODIFIERTYPE" : [ ],
				"METHODBODYLINETYPE" : [ ],
				"NUMBEROFMETHODVARIABLES" : 0,
				"NUMBEROFOUTGOINGMETHODS" : 0,
				"METHODRETURNTYPE" : "void",
				"METHODOVERRIDE" : [ ],
				"OUTGOINGMETHOD" : [ ],
				"NUMBEROFMETHODLINES" : 0,
				"METHODPARAMETER" : [ ]
			} ]
		},
		"MacOSFactory" : {
			"FIELDDETAIL" : [ ],
			"CLASSORINTERFACEDETAIL" : [ {
				"CLASSACCESSSPECIFIER" : "PUBLIC",
				"NUMBEROFMETHODCALLS" : 0,
				"EXTENDSFROM" : [ ],
				"IMPLEMENTSFROM" : [ "GUIFactory" ],
				"CLASSNAME" : "MacOSFactory",
				"ISINTERFACEORNOT" : false,
				"CLASSTYPEPARAMS" : [ ],
				"ISABSTRACTORNOT" : false,
				"CLASSMODIFIERTYPE" : [ "public" ]
			} ],
			"CONSTRUCTORDETAIL" : [ ],
			"VARIABLEDETAIL" : [ ],
			"METHODDETAIL" : [ {
				"METHODNAME" : "createButton",
				"NUMBEROFINCOMINGMETHODS" : 0,
				"INCOMINGMETHOD" : [ ],
				"METHODMODIFIERTYPE" : [ "public" ],
				"METHODBODYLINETYPE" : [ "RETURN" ],
				"NUMBEROFMETHODVARIABLES" : 0,
				"NUMBEROFOUTGOINGMETHODS" : 0,
				"METHODRETURNTYPE" : "Button",
				"METHODOVERRIDE" : [ "@Override" ],
				"OUTGOINGMETHOD" : [ ],
				"NUMBEROFMETHODLINES" : 1,
				"METHODPARAMETER" : [ ]
			}, {
				"METHODNAME" : "createCheckBox",
				"NUMBEROFINCOMINGMETHODS" : 0,
				"INCOMINGMETHOD" : [ ],
				"METHODMODIFIERTYPE" : [ "public" ],
				"METHODBODYLINETYPE" : [ "RETURN" ],
				"NUMBEROFMETHODVARIABLES" : 0,
				"NUMBEROFOUTGOINGMETHODS" : 0,
				"METHODRETURNTYPE" : "CheckBox",
				"METHODOVERRIDE" : [ "@Override" ],
				"OUTGOINGMETHOD" : [ ],
				"NUMBEROFMETHODLINES" : 1,
				"METHODPARAMETER" : [ ]
			} ]
		},
		"MacOSButton" : {
			"FIELDDETAIL" : [ ],
			"CLASSORINTERFACEDETAIL" : [ {
				"CLASSACCESSSPECIFIER" : "PUBLIC",
				"NUMBEROFMETHODCALLS" : 1,
				"EXTENDSFROM" : [ ],
				"IMPLEMENTSFROM" : [ "Button" ],
				"CLASSNAME" : "MacOSButton",
				"ISINTERFACEORNOT" : false,
				"CLASSTYPEPARAMS" : [ ],
				"ISABSTRACTORNOT" : false,
				"CLASSMODIFIERTYPE" : [ "public" ]
			} ],
			"CONSTRUCTORDETAIL" : [ ],
			"VARIABLEDETAIL" : [ ],
			"METHODDETAIL" : [ {
				"METHODNAME" : "paint",
				"NUMBEROFINCOMINGMETHODS" : 0,
				"INCOMINGMETHOD" : [ ],
				"METHODMODIFIERTYPE" : [ "public" ],
				"METHODBODYLINETYPE" : [ "EXPRESSION" ],
				"NUMBEROFMETHODVARIABLES" : 0,
				"NUMBEROFOUTGOINGMETHODS" : 1,
				"METHODRETURNTYPE" : "void",
				"METHODOVERRIDE" : [ "@Override" ],
				"OUTGOINGMETHOD" : [ ],
				"NUMBEROFMETHODLINES" : 1,
				"METHODPARAMETER" : [ ]
			} ]
		},
		"WindowsCheckBox" : {
			"FIELDDETAIL" : [ ],
			"CLASSORINTERFACEDETAIL" : [ {
				"CLASSACCESSSPECIFIER" : "PUBLIC",
				"NUMBEROFMETHODCALLS" : 1,
				"EXTENDSFROM" : [ ],
				"IMPLEMENTSFROM" : [ "CheckBox" ],
				"CLASSNAME" : "WindowsCheckBox",
				"ISINTERFACEORNOT" : false,
				"CLASSTYPEPARAMS" : [ ],
				"ISABSTRACTORNOT" : false,
				"CLASSMODIFIERTYPE" : [ "public" ]
			} ],
			"CONSTRUCTORDETAIL" : [ ],
			"VARIABLEDETAIL" : [ ],
			"METHODDETAIL" : [ {
				"METHODNAME" : "paint",
				"NUMBEROFINCOMINGMETHODS" : 0,
				"INCOMINGMETHOD" : [ ],
				"METHODMODIFIERTYPE" : [ "public" ],
				"METHODBODYLINETYPE" : [ "EXPRESSION" ],
				"NUMBEROFMETHODVARIABLES" : 0,
				"NUMBEROFOUTGOINGMETHODS" : 1,
				"METHODRETURNTYPE" : "void",
				"METHODOVERRIDE" : [ "@Override" ],
				"OUTGOINGMETHOD" : [ ],
				"NUMBEROFMETHODLINES" : 1,
				"METHODPARAMETER" : [ ]
			} ]
		},
		"Application" : {
			"FIELDDETAIL" : [ {
				"FIELDCOMMONTYPE" : "Button",
				"FIELDMODIFIERTYPE" : [ "private" ],
				"FIELDDECLARATION" : [ "button" ],
				"FIELDDATATYPE" : "Button",
				"FIELDACCESSSPECIFIER" : "PRIVATE"
			}, {
				"FIELDCOMMONTYPE" : "CheckBox",
				"FIELDMODIFIERTYPE" : [ "private" ],
				"FIELDDECLARATION" : [ "checkBox" ],
				"FIELDDATATYPE" : "CheckBox",
				"FIELDACCESSSPECIFIER" : "PRIVATE"
			} ],
			"CLASSORINTERFACEDETAIL" : [ {
				"CLASSACCESSSPECIFIER" : "PUBLIC",
				"NUMBEROFMETHODCALLS" : 4,
				"EXTENDSFROM" : [ ],
				"IMPLEMENTSFROM" : [ ],
				"CLASSNAME" : "Application",
				"ISINTERFACEORNOT" : false,
				"CLASSTYPEPARAMS" : [ ],
				"ISABSTRACTORNOT" : false,
				"CLASSMODIFIERTYPE" : [ "public" ]
			} ],
			"CONSTRUCTORDETAIL" : [ {
				"CONSTRUCTORMODIFIER" : [ "public" ],
				"CONSTRUCTORPARAMETER" : [ {
					"PARAMETERNAME" : "factory",
					"PARAMETERTYPE" : "GUIFactory"
				} ]
			} ],
			"VARIABLEDETAIL" : [ ],
			"METHODDETAIL" : [ {
				"METHODNAME" : "paint",
				"NUMBEROFINCOMINGMETHODS" : 0,
				"INCOMINGMETHOD" : [ ],
				"METHODMODIFIERTYPE" : [ "public" ],
				"METHODBODYLINETYPE" : [ "EXPRESSION", "EXPRESSION" ],
				"NUMBEROFMETHODVARIABLES" : 0,
				"NUMBEROFOUTGOINGMETHODS" : 2,
				"METHODRETURNTYPE" : "void",
				"METHODOVERRIDE" : [ ],
				"OUTGOINGMETHOD" : [ ],
				"NUMBEROFMETHODLINES" : 2,
				"METHODPARAMETER" : [ ]
			} ]
		},
		"MacOSCheckBox" : {
			"FIELDDETAIL" : [ ],
			"CLASSORINTERFACEDETAIL" : [ {
				"CLASSACCESSSPECIFIER" : "PUBLIC",
				"NUMBEROFMETHODCALLS" : 1,
				"EXTENDSFROM" : [ ],
				"IMPLEMENTSFROM" : [ "CheckBox" ],
				"CLASSNAME" : "MacOSCheckBox",
				"ISINTERFACEORNOT" : false,
				"CLASSTYPEPARAMS" : [ ],
				"ISABSTRACTORNOT" : false,
				"CLASSMODIFIERTYPE" : [ "public" ]
			} ],
			"CONSTRUCTORDETAIL" : [ ],
			"VARIABLEDETAIL" : [ ],
			"METHODDETAIL" : [ {
				"METHODNAME" : "paint",
				"NUMBEROFINCOMINGMETHODS" : 0,
				"INCOMINGMETHOD" : [ ],
				"METHODMODIFIERTYPE" : [ "public" ],
				"METHODBODYLINETYPE" : [ "EXPRESSION" ],
				"NUMBEROFMETHODVARIABLES" : 0,
				"NUMBEROFOUTGOINGMETHODS" : 1,
				"METHODRETURNTYPE" : "void",
				"METHODOVERRIDE" : [ "@Override" ],
				"OUTGOINGMETHOD" : [ ],
				"NUMBEROFMETHODLINES" : 1,
				"METHODPARAMETER" : [ ]
			} ]
		},
		"GUIFactory" : {
			"FIELDDETAIL" : [ ],
			"CLASSORINTERFACEDETAIL" : [ {
				"CLASSACCESSSPECIFIER" : "PUBLIC",
				"NUMBEROFMETHODCALLS" : 0,
				"EXTENDSFROM" : [ ],
				"IMPLEMENTSFROM" : [ ],
				"CLASSNAME" : "GUIFactory",
				"ISINTERFACEORNOT" : true,
				"CLASSTYPEPARAMS" : [ ],
				"ISABSTRACTORNOT" : false,
				"CLASSMODIFIERTYPE" : [ "public" ]
			} ],
			"CONSTRUCTORDETAIL" : [ ],
			"VARIABLEDETAIL" : [ ],
			"METHODDETAIL" : [ {
				"METHODNAME" : "createButton",
				"NUMBEROFINCOMINGMETHODS" : 0,
				"INCOMINGMETHOD" : [ ],
				"METHODMODIFIERTYPE" : [ ],
				"METHODBODYLINETYPE" : [ ],
				"NUMBEROFMETHODVARIABLES" : 0,
				"NUMBEROFOUTGOINGMETHODS" : 0,
				"METHODRETURNTYPE" : "Button",
				"METHODOVERRIDE" : [ ],
				"OUTGOINGMETHOD" : [ ],
				"NUMBEROFMETHODLINES" : 0,
				"METHODPARAMETER" : [ ]
			}, {
				"METHODNAME" : "createCheckBox",
				"NUMBEROFINCOMINGMETHODS" : 0,
				"INCOMINGMETHOD" : [ ],
				"METHODMODIFIERTYPE" : [ ],
				"METHODBODYLINETYPE" : [ ],
				"NUMBEROFMETHODVARIABLES" : 0,
				"NUMBEROFOUTGOINGMETHODS" : 0,
				"METHODRETURNTYPE" : "CheckBox",
				"METHODOVERRIDE" : [ ],
				"OUTGOINGMETHOD" : [ ],
				"NUMBEROFMETHODLINES" : 0,
				"METHODPARAMETER" : [ ]
			} ]
		}
	},
	"summary_NLG" : {
		"abstract_factory" : {
			"WindowsOSFactory" : [ "WindowsOSFactory acts as a factory for GUIFactory, which overrides createButton method of GUIFactory, createCheckBox method of GUIFactory." ],
			"WindowsButton" : [ "WindowsButton acts as a product for GUIFactory, which overrides paint method of Button." ],
			"Button" : [ "Button acts as an abstract product for Button, which is inherited by WindowsButton, MacOSButton." ],
			"CheckBox" : [ "CheckBox acts as an abstract product for CheckBox, which is inherited by WindowsCheckBox, MacOSCheckBox." ],
			"MacOSFactory" : [ "MacOSFactory acts as a factory for GUIFactory, which overrides createButton method of GUIFactory, createCheckBox method of GUIFactory." ],
			"MacOSButton" : [ "MacOSButton acts as a product for GUIFactory, which overrides paint method of Button." ],
			"WindowsCheckBox" : [ "WindowsCheckBox acts as a product for GUIFactory, which overrides paint method of CheckBox." ],
			"MacOSCheckBox" : [ "MacOSCheckBox acts as a product for GUIFactory, which overrides paint method of CheckBox." ],
			"GUIFactory" : [ "GUIFactory acts as an abstract factory for Button, CheckBox, which is inherited by WindowsOSFactory, MacOSFactory." ]
		},
		"memento" : {
			"WindowsOSFactory" : [ "WindowsOSFactory acts as an originator for memento CheckBox, which creates a CheckBox Check Box to.", "WindowsOSFactory acts as an originator for memento Button, which creates a Button Button to." ],
			"WindowsButton" : [ "WindowsButton acts as a memento, which paints." ],
			"Button" : [ "Button acts as a memento, which is inherited by WindowsButton, MacOSButton, which paints." ],
			"CheckBox" : [ "CheckBox acts as a memento, which is inherited by WindowsCheckBox, MacOSCheckBox, which paints." ],
			"MacOSFactory" : [ "MacOSFactory acts as an originator for memento Button, which creates a Button Button to.", "MacOSFactory acts as an originator for memento CheckBox, which creates a CheckBox Check Box to." ],
			"MacOSButton" : [ "MacOSButton acts as a memento, which paints." ],
			"WindowsCheckBox" : [ "WindowsCheckBox acts as a memento, which paints." ],
			"Application" : [ "Application acts as a caretaker for memento CheckBox, which paints.", "Application acts as a caretaker for memento Button, which paints." ],
			"MacOSCheckBox" : [ "MacOSCheckBox acts as a memento, which paints." ],
			"GUIFactory" : [ "GUIFactory acts as an originator for memento Button, which is inherited by, which creates a Button Button to.", "GUIFactory acts as an originator for memento CheckBox, which is inherited by, which creates a CheckBox Check Box to." ]
		},
		"factory_method" : {
			"WindowsOSFactory" : [ "WindowsOSFactory acts as a factory method for CheckBox, which is inherited by GUIFactory, GUIFactory." ],
			"CheckBox" : [ "CheckBox acts as an abstract product for WindowsOSFactory, which is inherited by WindowsCheckBox, MacOSCheckBox." ],
			"WindowsCheckBox" : [ "WindowsCheckBox acts as a product for WindowsOSFactory, which overrides paint method of CheckBox." ],
			"MacOSCheckBox" : [ "MacOSCheckBox acts as a product for WindowsOSFactory, which overrides paint method of CheckBox." ],
			"GUIFactory" : [ "GUIFactory acts as a factory for WindowsOSFactory, which overrides." ]
		}
	}
}