{
	"luisburgos-memento-pattern" : {
		"Caretaker" : {
			"FIELDDETAIL" : [ {
				"FIELDCOMMONTYPE" : "List<Memento>",
				"FIELDMODIFIERTYPE" : [ "private" ],
				"FIELDDECLARATION" : [ "savedStates = new ArrayList<Memento>()" ],
				"FIELDDATATYPE" : "List<Memento>",
				"FIELDACCESSSPECIFIER" : "PRIVATE"
			} ],
			"CLASSORINTERFACEDETAIL" : [ {
				"CLASSACCESSSPECIFIER" : "PUBLIC",
				"NUMBEROFMETHODCALLS" : 2,
				"EXTENDSFROM" : [ ],
				"IMPLEMENTSFROM" : [ ],
				"CLASSNAME" : "Caretaker",
				"ISINTERFACEORNOT" : false,
				"CLASSTYPEPARAMS" : [ ],
				"ISABSTRACTORNOT" : false,
				"CLASSMODIFIERTYPE" : [ "public" ]
			} ],
			"CONSTRUCTORDETAIL" : [ ],
			"VARIABLEDETAIL" : [ ],
			"METHODDETAIL" : [ {
				"METHODNAME" : "addMemento",
				"NUMBEROFINCOMINGMETHODS" : 0,
				"INCOMINGMETHOD" : [ ],
				"METHODMODIFIERTYPE" : [ "public" ],
				"METHODBODYLINETYPE" : [ "EXPRESSION" ],
				"NUMBEROFMETHODVARIABLES" : 0,
				"NUMBEROFOUTGOINGMETHODS" : 1,
				"METHODRETURNTYPE" : "void",
				"METHODOVERRIDE" : [ ],
				"OUTGOINGMETHOD" : [ ],
				"NUMBEROFMETHODLINES" : 1,
				"METHODPARAMETER" : [ {
					"PARAMETERNAME" : "m",
					"PARAMETERTYPE" : "Memento"
				} ]
			}, {
				"METHODNAME" : "getMemento",
				"NUMBEROFINCOMINGMETHODS" : 0,
				"INCOMINGMETHOD" : [ ],
				"METHODMODIFIERTYPE" : [ "public" ],
				"METHODBODYLINETYPE" : [ "RETURN" ],
				"NUMBEROFMETHODVARIABLES" : 0,
				"NUMBEROFOUTGOINGMETHODS" : 1,
				"METHODRETURNTYPE" : "Memento",
				"METHODOVERRIDE" : [ ],
				"OUTGOINGMETHOD" : [ ],
				"NUMBEROFMETHODLINES" : 1,
				"METHODPARAMETER" : [ {
					"PARAMETERNAME" : "index",
					"PARAMETERTYPE" : "int"
				} ]
			} ]
		},
		"Memento" : {
			"FIELDDETAIL" : [ {
				"FIELDCOMMONTYPE" : "String",
				"FIELDMODIFIERTYPE" : [ "private" ],
				"FIELDDECLARATION" : [ "state" ],
				"FIELDDATATYPE" : "String",
				"FIELDACCESSSPECIFIER" : "PRIVATE"
			} ],
			"CLASSORINTERFACEDETAIL" : [ {
				"CLASSACCESSSPECIFIER" : "PUBLIC",
				"NUMBEROFMETHODCALLS" : 0,
				"EXTENDSFROM" : [ ],
				"IMPLEMENTSFROM" : [ ],
				"CLASSNAME" : "Memento",
				"ISINTERFACEORNOT" : false,
				"CLASSTYPEPARAMS" : [ ],
				"ISABSTRACTORNOT" : false,
				"CLASSMODIFIERTYPE" : [ "public" ]
			} ],
			"CONSTRUCTORDETAIL" : [ {
				"CONSTRUCTORMODIFIER" : [ "public" ],
				"CONSTRUCTORPARAMETER" : [ {
					"PARAMETERNAME" : "stateToSave",
					"PARAMETERTYPE" : "String"
				} ]
			} ],
			"VARIABLEDETAIL" : [ ],
			"METHODDETAIL" : [ {
				"METHODNAME" : "getSavedState",
				"NUMBEROFINCOMINGMETHODS" : 0,
				"INCOMINGMETHOD" : [ ],
				"METHODMODIFIERTYPE" : [ "public" ],
				"METHODBODYLINETYPE" : [ "RETURN" ],
				"NUMBEROFMETHODVARIABLES" : 0,
				"NUMBEROFOUTGOINGMETHODS" : 0,
				"METHODRETURNTYPE" : "String",
				"METHODOVERRIDE" : [ ],
				"OUTGOINGMETHOD" : [ ],
				"NUMBEROFMETHODLINES" : 1,
				"METHODPARAMETER" : [ ]
			} ]
		},
		"Originator" : {
			"FIELDDETAIL" : [ {
				"FIELDCOMMONTYPE" : "String",
				"FIELDMODIFIERTYPE" : [ "private" ],
				"FIELDDECLARATION" : [ "state" ],
				"FIELDDATATYPE" : "String",
				"FIELDACCESSSPECIFIER" : "PRIVATE"
			} ],
			"CLASSORINTERFACEDETAIL" : [ {
				"CLASSACCESSSPECIFIER" : "PUBLIC",
				"NUMBEROFMETHODCALLS" : 4,
				"EXTENDSFROM" : [ ],
				"IMPLEMENTSFROM" : [ ],
				"CLASSNAME" : "Originator",
				"ISINTERFACEORNOT" : false,
				"CLASSTYPEPARAMS" : [ ],
				"ISABSTRACTORNOT" : false,
				"CLASSMODIFIERTYPE" : [ "public" ]
			} ],
			"CONSTRUCTORDETAIL" : [ ],
			"VARIABLEDETAIL" : [ ],
			"METHODDETAIL" : [ {
				"METHODNAME" : "set",
				"NUMBEROFINCOMINGMETHODS" : 0,
				"INCOMINGMETHOD" : [ ],
				"METHODMODIFIERTYPE" : [ "public" ],
				"METHODBODYLINETYPE" : [ "EXPRESSION", "EXPRESSION" ],
				"NUMBEROFMETHODVARIABLES" : 0,
				"NUMBEROFOUTGOINGMETHODS" : 1,
				"METHODRETURNTYPE" : "void",
				"METHODOVERRIDE" : [ ],
				"OUTGOINGMETHOD" : [ ],
				"NUMBEROFMETHODLINES" : 2,
				"METHODPARAMETER" : [ {
					"PARAMETERNAME" : "state",
					"PARAMETERTYPE" : "String"
				} ]
			}, {
				"METHODNAME" : "saveToMemento",
				"NUMBEROFINCOMINGMETHODS" : 0,
				"INCOMINGMETHOD" : [ ],
				"METHODMODIFIERTYPE" : [ "public" ],
				"METHODBODYLINETYPE" : [ "EXPRESSION", "RETURN" ],
				"NUMBEROFMETHODVARIABLES" : 0,
				"NUMBEROFOUTGOINGMETHODS" : 1,
				"METHODRETURNTYPE" : "Memento",
				"METHODOVERRIDE" : [ ],
				"OUTGOINGMETHOD" : [ ],
				"NUMBEROFMETHODLINES" : 2,
				"METHODPARAMETER" : [ ]
			}, {
				"METHODNAME" : "restoreFromMemento",
				"NUMBEROFINCOMINGMETHODS" : 0,
				"INCOMINGMETHOD" : [ ],
				"METHODMODIFIERTYPE" : [ "public" ],
				"METHODBODYLINETYPE" : [ "EXPRESSION", "EXPRESSION" ],
				"NUMBEROFMETHODVARIABLES" : 0,
				"NUMBEROFOUTGOINGMETHODS" : 2,
				"METHODRETURNTYPE" : "void",
				"METHODOVERRIDE" : [ ],
				"OUTGOINGMETHOD" : [ ],
				"NUMBEROFMETHODLINES" : 2,
				"METHODPARAMETER" : [ {
					"PARAMETERNAME" : "m",
					"PARAMETERTYPE" : "Memento"
				} ]
			} ]
		},
		"MementoTest" : {
			"FIELDDETAIL" : [ ],
			"CLASSORINTERFACEDETAIL" : [ {
				"CLASSACCESSSPECIFIER" : "PUBLIC",
				"NUMBEROFMETHODCALLS" : 10,
				"EXTENDSFROM" : [ ],
				"IMPLEMENTSFROM" : [ ],
				"CLASSNAME" : "MementoTest",
				"ISINTERFACEORNOT" : false,
				"CLASSTYPEPARAMS" : [ ],
				"ISABSTRACTORNOT" : false,
				"CLASSMODIFIERTYPE" : [ "public" ]
			} ],
			"CONSTRUCTORDETAIL" : [ ],
			"VARIABLEDETAIL" : [ {
				"VARIABLEDECLARATION" : [ "caretaker = new Caretaker()" ],
				"VARIABLECOMMONTYPE" : "Caretaker",
				"VARIABLEELEMENTTYPE" : "Caretaker"
			}, {
				"VARIABLEDECLARATION" : [ "originator = new Originator()" ],
				"VARIABLECOMMONTYPE" : "Originator",
				"VARIABLEELEMENTTYPE" : "Originator"
			} ],
			"METHODDETAIL" : [ {
				"METHODNAME" : "main",
				"NUMBEROFINCOMINGMETHODS" : 0,
				"INCOMINGMETHOD" : [ ],
				"METHODMODIFIERTYPE" : [ "public", "static" ],
				"METHODBODYLINETYPE" : [ "EXPRESSION", "EXPRESSION", "EXPRESSION", "EXPRESSION", "EXPRESSION", "EXPRESSION", "EXPRESSION", "EXPRESSION", "EXPRESSION" ],
				"NUMBEROFMETHODVARIABLES" : 2,
				"NUMBEROFOUTGOINGMETHODS" : 10,
				"METHODRETURNTYPE" : "void",
				"METHODOVERRIDE" : [ ],
				"OUTGOINGMETHOD" : [ ],
				"NUMBEROFMETHODLINES" : 9,
				"METHODPARAMETER" : [ {
					"PARAMETERNAME" : "args",
					"PARAMETERTYPE" : "String[]"
				} ]
			} ]
		}
	},
	"final_summary" : "\nobserver:\nCaretaker acts as a publisher for observer Memento, which is inherited by, which adds Memento parameter of m Memento, which gets int parameter of index Memento. It is a public class. The 2 methods of Caretaker are addMemento (void) and getMemento (Memento). No methods call addMemento and addMemento calls no methods. No methods call getMemento and getMemento calls no methods.\n\nMemento acts as an observer for publisher Caretaker, which is inherited by, which gets Saved State. It is a public class. The only method of Memento is getSavedState (String). No methods call getSavedState and getSavedState calls no methods.\n\nOriginator does not have any design pattern.  It is a public class. The 3 methods of Originator are set (void), saveToMemento (Memento) and restoreFromMemento (void). No methods call set and set calls no methods. No methods call saveToMemento and saveToMemento calls no methods. No methods call restoreFromMemento and restoreFromMemento calls no methods.\n\nMementoTest does not have any design pattern.  It is a public class. The only method of MementoTest is main (void). No methods call main and main calls no methods.\n\n\nmemento:\nCaretaker acts as a caretaker for memento Memento, which adds Memento parameter of m Memento, which gets int parameter of index Memento. It is a public class. The 2 methods of Caretaker are addMemento (void) and getMemento (Memento). No methods call addMemento and addMemento calls no methods. No methods call getMemento and getMemento calls no methods.\n\nMemento acts as a memento, which gets Saved State. It is a public class. The only method of Memento is getSavedState (String). No methods call getSavedState and getSavedState calls no methods.\n\nOriginator acts as an originator for memento Memento, which saves a Memento To Memento to, which restores Memento parameter of m From Memento. It is a public class. The 3 methods of Originator are set (void), saveToMemento (Memento) and restoreFromMemento (void). No methods call set and set calls no methods. No methods call saveToMemento and saveToMemento calls no methods. No methods call restoreFromMemento and restoreFromMemento calls no methods.\n\nMementoTest does not have any design pattern.  It is a public class. The only method of MementoTest is main (void). No methods call main and main calls no methods.\n\n",
	"design_pattern" : [ {
		"observer" : {
			"Memento" : {
				"concrete_observer" : [ ],
				"publisher" : {
					"Caretaker" : [ ]
				}
			}
		}
	}, {
		"memento" : {
			"Memento" : {
				"caretaker" : {
					"Caretaker" : [ ]
				},
				"originator" : {
					"Originator" : [ ]
				},
				"concrete_memento" : [ ]
			}
		}
	} ],
	"summary_NLG" : {
		"observer" : {
			"Caretaker" : [ "Caretaker acts as a publisher for observer Memento, which is inherited by, which adds Memento parameter of m Memento, which gets int parameter of index Memento." ],
			"Memento" : [ "Memento acts as an observer for publisher Caretaker, which is inherited by, which gets Saved State." ]
		},
		"memento" : {
			"Caretaker" : [ "Caretaker acts as a caretaker for memento Memento, which adds Memento parameter of m Memento, which gets int parameter of index Memento." ],
			"Memento" : [ "Memento acts as a memento, which gets Saved State." ],
			"Originator" : [ "Originator acts as an originator for memento Memento, which saves a Memento To Memento to, which restores Memento parameter of m From Memento." ]
		}
	}
}