{
	"final_summary" : "\nobserver:\nLoginEventListener acts as an observer for publisher LoginBean, which is inherited by LoginValidatorA, LoginValidatorB, which validates LoginEvent parameter of event Login. It is a public interface that extends EventListener. The only method of LoginEventListener is validateLogin (void). No methods call validateLogin and validateLogin calls no methods.\n\nMyObserver does not have any design pattern.  It is a public interface. The only method of MyObserver is response (void). No methods call response and response calls no methods.\n\nMouse does not have any design pattern.  It is a public class that implements MyObserver. The only method of Mouse is response (void). No methods call response and response calls no methods.\n\nLoginBean acts as a publisher for observer LoginEventListener, which is inherited by, which adds LoginEventListener parameter of lel Login Event Listener, which fires Object parameter of object, String parameter of userName, String parameter of password Login Event, which actions ActionEvent parameter of event Performed. It is a public class that extends JPanel and that implements ActionListener. The 3 methods of LoginBean are addLoginEventListener (void), fireLoginEvent (void) and actionPerformed (void). No methods call addLoginEventListener and addLoginEventListener calls no methods. Only one method ( actionPerformed method of class LoginBean ) calls fireLoginEvent and fireLoginEvent calls no methods. No methods call actionPerformed and actionPerformed calls only one method : fireLoginEvent method of class LoginBean.\n\nMySubject does not have any design pattern.  It is a public abstract class. The 3 methods of MySubject are attach (void), detach (void) and cry (void). No methods call attach and attach calls no methods. No methods call detach and detach calls no methods. No methods call cry and cry calls no methods.\n\nCat does not have any design pattern.  It is a public class that extends MySubject. The only method of Cat is cry (void). No methods call cry and cry calls no methods.\n\nLoginEvent does not have any design pattern.  It is a public class that extends EventObject. The 4 methods of LoginEvent are setUserName (void), getUserName (String), setPassword (void) and getPassword (String). No methods call setUserName and setUserName calls no methods. No methods call getUserName and getUserName calls no methods. No methods call setPassword and setPassword calls no methods. No methods call getPassword and getPassword calls no methods.\n\nLoginValidatorA acts as an observer, which validates LoginEvent parameter of event Login, which mains String[] parameter of args. It is a public class that extends JFrame and that implements LoginEventListener. The 2 methods of LoginValidatorA are validateLogin (void) and main (void). No methods call validateLogin and validateLogin calls no methods. No methods call main and main calls no methods.\n\nLoginValidatorB acts as an observer, which validates LoginEvent parameter of event Login, which mains String[] parameter of args. It is a public class that extends JFrame and that implements LoginEventListener. The 2 methods of LoginValidatorB are validateLogin (void) and main (void). No methods call validateLogin and validateLogin calls no methods. No methods call main and main calls no methods.\n\nClient does not have any design pattern.  It is a public class. The only method of Client is main (void). No methods call main and main calls no methods.\n\nDog does not have any design pattern.  It is a public class that implements MyObserver. The only method of Dog is response (void). No methods call response and response calls no methods.\n\nPig does not have any design pattern.  It is a public class that implements MyObserver. The only method of Pig is response (void). No methods call response and response calls no methods.\n\n\nadapter:\nLoginEventListener acts as a target for adapter LoginValidatorA, which adapts to LoginEventListener. LoginEventListener acts as a target for adapter LoginValidatorB, which adapts to LoginEventListener. It is a public interface that extends EventListener. The only method of LoginEventListener is validateLogin (void). No methods call validateLogin and validateLogin calls no methods.\n\nMyObserver does not have any design pattern.  It is a public interface. The only method of MyObserver is response (void). No methods call response and response calls no methods.\n\nMouse does not have any design pattern.  It is a public class that implements MyObserver. The only method of Mouse is response (void). No methods call response and response calls no methods.\n\nLoginBean acts as an adaptee for adapter LoginValidatorB, which adapts to LoginEventListener, which adapts to LoginEventListener, which adapts to LoginEventListener. LoginBean acts as an adaptee for adapter LoginValidatorA, which adapts to LoginEventListener, which adapts to LoginEventListener, which adapts to LoginEventListener. It is a public class that extends JPanel and that implements ActionListener. The 3 methods of LoginBean are addLoginEventListener (void), fireLoginEvent (void) and actionPerformed (void). No methods call addLoginEventListener and addLoginEventListener calls no methods. Only one method ( actionPerformed method of class LoginBean ) calls fireLoginEvent and fireLoginEvent calls no methods. No methods call actionPerformed and actionPerformed calls only one method : fireLoginEvent method of class LoginBean.\n\nMySubject does not have any design pattern.  It is a public abstract class. The 3 methods of MySubject are attach (void), detach (void) and cry (void). No methods call attach and attach calls no methods. No methods call detach and detach calls no methods. No methods call cry and cry calls no methods.\n\nCat does not have any design pattern.  It is a public class that extends MySubject. The only method of Cat is cry (void). No methods call cry and cry calls no methods.\n\nLoginEvent does not have any design pattern.  It is a public class that extends EventObject. The 4 methods of LoginEvent are setUserName (void), getUserName (String), setPassword (void) and getPassword (String). No methods call setUserName and setUserName calls no methods. No methods call getUserName and getUserName calls no methods. No methods call setPassword and setPassword calls no methods. No methods call getPassword and getPassword calls no methods.\n\nLoginValidatorA acts as an adapter, which adapts to LoginEventListener, which adapts to LoginEventListener. It is a public class that extends JFrame and that implements LoginEventListener. The 2 methods of LoginValidatorA are validateLogin (void) and main (void). No methods call validateLogin and validateLogin calls no methods. No methods call main and main calls no methods.\n\nLoginValidatorB acts as an adapter, which adapts to LoginEventListener, which adapts to LoginEventListener. It is a public class that extends JFrame and that implements LoginEventListener. The 2 methods of LoginValidatorB are validateLogin (void) and main (void). No methods call validateLogin and validateLogin calls no methods. No methods call main and main calls no methods.\n\nClient does not have any design pattern.  It is a public class. The only method of Client is main (void). No methods call main and main calls no methods.\n\nDog does not have any design pattern.  It is a public class that implements MyObserver. The only method of Dog is response (void). No methods call response and response calls no methods.\n\nPig does not have any design pattern.  It is a public class that implements MyObserver. The only method of Pig is response (void). No methods call response and response calls no methods.\n\n",
	"design_pattern" : [ {
		"adapter" : {
			"LoginValidatorA" : {
				"adaptee" : [ "LoginBean" ],
				"target" : [ "LoginEventListener" ]
			},
			"LoginValidatorB" : {
				"adaptee" : [ "LoginBean" ],
				"target" : [ "LoginEventListener" ]
			}
		}
	}, {
		"observer" : {
			"LoginEventListener" : {
				"concrete_observer" : [ "LoginValidatorA", "LoginValidatorB" ],
				"publisher" : {
					"LoginBean" : [ ]
				}
			}
		}
	} ],
	"quanke-Chapter 23 Observer" : {
		"LoginEventListener" : {
			"FIELDDETAIL" : [ ],
			"CLASSORINTERFACEDETAIL" : [ {
				"CLASSACCESSSPECIFIER" : "PUBLIC",
				"NUMBEROFMETHODCALLS" : 0,
				"EXTENDSFROM" : [ "EventListener" ],
				"IMPLEMENTSFROM" : [ ],
				"CLASSNAME" : "LoginEventListener",
				"ISINTERFACEORNOT" : true,
				"CLASSTYPEPARAMS" : [ ],
				"ISABSTRACTORNOT" : false,
				"CLASSMODIFIERTYPE" : [ "public" ]
			} ],
			"CONSTRUCTORDETAIL" : [ ],
			"VARIABLEDETAIL" : [ ],
			"METHODDETAIL" : [ {
				"METHODNAME" : "validateLogin",
				"NUMBEROFINCOMINGMETHODS" : 0,
				"INCOMINGMETHOD" : [ ],
				"METHODMODIFIERTYPE" : [ "public" ],
				"METHODBODYLINETYPE" : [ ],
				"NUMBEROFMETHODVARIABLES" : 0,
				"NUMBEROFOUTGOINGMETHODS" : 0,
				"METHODRETURNTYPE" : "void",
				"METHODOVERRIDE" : [ ],
				"OUTGOINGMETHOD" : [ ],
				"NUMBEROFMETHODLINES" : 0,
				"METHODPARAMETER" : [ {
					"PARAMETERNAME" : "event",
					"PARAMETERTYPE" : "LoginEvent"
				} ]
			} ]
		},
		"MyObserver" : {
			"FIELDDETAIL" : [ ],
			"CLASSORINTERFACEDETAIL" : [ {
				"CLASSACCESSSPECIFIER" : "PUBLIC",
				"NUMBEROFMETHODCALLS" : 0,
				"EXTENDSFROM" : [ ],
				"IMPLEMENTSFROM" : [ ],
				"CLASSNAME" : "MyObserver",
				"ISINTERFACEORNOT" : true,
				"CLASSTYPEPARAMS" : [ ],
				"ISABSTRACTORNOT" : false,
				"CLASSMODIFIERTYPE" : [ "public" ]
			} ],
			"CONSTRUCTORDETAIL" : [ ],
			"VARIABLEDETAIL" : [ ],
			"METHODDETAIL" : [ {
				"METHODNAME" : "response",
				"NUMBEROFINCOMINGMETHODS" : 0,
				"INCOMINGMETHOD" : [ ],
				"METHODMODIFIERTYPE" : [ ],
				"METHODBODYLINETYPE" : [ ],
				"NUMBEROFMETHODVARIABLES" : 0,
				"NUMBEROFOUTGOINGMETHODS" : 0,
				"METHODRETURNTYPE" : "void",
				"METHODOVERRIDE" : [ ],
				"OUTGOINGMETHOD" : [ ],
				"NUMBEROFMETHODLINES" : 0,
				"METHODPARAMETER" : [ ]
			} ]
		},
		"Mouse" : {
			"FIELDDETAIL" : [ ],
			"CLASSORINTERFACEDETAIL" : [ {
				"CLASSACCESSSPECIFIER" : "PUBLIC",
				"NUMBEROFMETHODCALLS" : 1,
				"EXTENDSFROM" : [ ],
				"IMPLEMENTSFROM" : [ "MyObserver" ],
				"CLASSNAME" : "Mouse",
				"ISINTERFACEORNOT" : false,
				"CLASSTYPEPARAMS" : [ ],
				"ISABSTRACTORNOT" : false,
				"CLASSMODIFIERTYPE" : [ "public" ]
			} ],
			"CONSTRUCTORDETAIL" : [ ],
			"VARIABLEDETAIL" : [ ],
			"METHODDETAIL" : [ {
				"METHODNAME" : "response",
				"NUMBEROFINCOMINGMETHODS" : 0,
				"INCOMINGMETHOD" : [ ],
				"METHODMODIFIERTYPE" : [ "public" ],
				"METHODBODYLINETYPE" : [ "EXPRESSION" ],
				"NUMBEROFMETHODVARIABLES" : 0,
				"NUMBEROFOUTGOINGMETHODS" : 1,
				"METHODRETURNTYPE" : "void",
				"METHODOVERRIDE" : [ ],
				"OUTGOINGMETHOD" : [ ],
				"NUMBEROFMETHODLINES" : 1,
				"METHODPARAMETER" : [ ]
			} ]
		},
		"LoginBean" : {
			"FIELDDETAIL" : [ {
				"FIELDCOMMONTYPE" : "JLabel",
				"FIELDMODIFIERTYPE" : [ "private" ],
				"FIELDDECLARATION" : [ "labUserName", "labPassword" ],
				"FIELDDATATYPE" : "JLabel",
				"FIELDACCESSSPECIFIER" : "PRIVATE"
			}, {
				"FIELDCOMMONTYPE" : "JTextField",
				"FIELDMODIFIERTYPE" : [ "private" ],
				"FIELDDECLARATION" : [ "txtUserName" ],
				"FIELDDATATYPE" : "JTextField",
				"FIELDACCESSSPECIFIER" : "PRIVATE"
			}, {
				"FIELDCOMMONTYPE" : "JPasswordField",
				"FIELDMODIFIERTYPE" : [ "private" ],
				"FIELDDECLARATION" : [ "txtPassword" ],
				"FIELDDATATYPE" : "JPasswordField",
				"FIELDACCESSSPECIFIER" : "PRIVATE"
			}, {
				"FIELDCOMMONTYPE" : "JButton",
				"FIELDMODIFIERTYPE" : [ "private" ],
				"FIELDDECLARATION" : [ "btnLogin", "btnClear" ],
				"FIELDDATATYPE" : "JButton",
				"FIELDACCESSSPECIFIER" : "PRIVATE"
			}, {
				"FIELDCOMMONTYPE" : "LoginEventListener",
				"FIELDMODIFIERTYPE" : [ "private" ],
				"FIELDDECLARATION" : [ "lel" ],
				"FIELDDATATYPE" : "LoginEventListener",
				"FIELDACCESSSPECIFIER" : "PRIVATE"
			}, {
				"FIELDCOMMONTYPE" : "LoginEvent",
				"FIELDMODIFIERTYPE" : [ "private" ],
				"FIELDDECLARATION" : [ "le" ],
				"FIELDDATATYPE" : "LoginEvent",
				"FIELDACCESSSPECIFIER" : "PRIVATE"
			} ],
			"CLASSORINTERFACEDETAIL" : [ {
				"CLASSACCESSSPECIFIER" : "PUBLIC",
				"NUMBEROFMETHODCALLS" : 17,
				"EXTENDSFROM" : [ "JPanel", "ActionListener" ],
				"IMPLEMENTSFROM" : [ "ActionListener" ],
				"CLASSNAME" : "LoginBean",
				"ISINTERFACEORNOT" : false,
				"CLASSTYPEPARAMS" : [ ],
				"ISABSTRACTORNOT" : false,
				"CLASSMODIFIERTYPE" : [ "public" ]
			} ],
			"CONSTRUCTORDETAIL" : [ {
				"CONSTRUCTORMODIFIER" : [ "public" ],
				"CONSTRUCTORPARAMETER" : [ ]
			} ],
			"VARIABLEDETAIL" : [ {
				"VARIABLEDECLARATION" : [ "userName = this.txtUserName.getText()" ],
				"VARIABLECOMMONTYPE" : "String",
				"VARIABLEELEMENTTYPE" : "String"
			}, {
				"VARIABLEDECLARATION" : [ "password = this.txtPassword.getText()" ],
				"VARIABLECOMMONTYPE" : "String",
				"VARIABLEELEMENTTYPE" : "String"
			} ],
			"METHODDETAIL" : [ {
				"METHODNAME" : "addLoginEventListener",
				"NUMBEROFINCOMINGMETHODS" : 0,
				"INCOMINGMETHOD" : [ ],
				"METHODMODIFIERTYPE" : [ "public" ],
				"METHODBODYLINETYPE" : [ "EXPRESSION" ],
				"NUMBEROFMETHODVARIABLES" : 0,
				"NUMBEROFOUTGOINGMETHODS" : 0,
				"METHODRETURNTYPE" : "void",
				"METHODOVERRIDE" : [ ],
				"OUTGOINGMETHOD" : [ ],
				"NUMBEROFMETHODLINES" : 1,
				"METHODPARAMETER" : [ {
					"PARAMETERNAME" : "lel",
					"PARAMETERTYPE" : "LoginEventListener"
				} ]
			}, {
				"METHODNAME" : "fireLoginEvent",
				"NUMBEROFINCOMINGMETHODS" : 1,
				"INCOMINGMETHOD" : [ {
					"CALLEDMETHODNAME" : "actionPerformed",
					"CALLEDCLASS" : "LoginBean"
				} ],
				"METHODMODIFIERTYPE" : [ "private" ],
				"METHODBODYLINETYPE" : [ "EXPRESSION", "EXPRESSION" ],
				"NUMBEROFMETHODVARIABLES" : 0,
				"NUMBEROFOUTGOINGMETHODS" : 1,
				"METHODRETURNTYPE" : "void",
				"METHODOVERRIDE" : [ ],
				"OUTGOINGMETHOD" : [ ],
				"NUMBEROFMETHODLINES" : 2,
				"METHODPARAMETER" : [ {
					"PARAMETERNAME" : "object",
					"PARAMETERTYPE" : "Object"
				}, {
					"PARAMETERNAME" : "userName",
					"PARAMETERTYPE" : "String"
				}, {
					"PARAMETERNAME" : "password",
					"PARAMETERTYPE" : "String"
				} ]
			}, {
				"METHODNAME" : "actionPerformed",
				"NUMBEROFINCOMINGMETHODS" : 0,
				"INCOMINGMETHOD" : [ ],
				"METHODMODIFIERTYPE" : [ "public" ],
				"METHODBODYLINETYPE" : [ "IF", "IF" ],
				"NUMBEROFMETHODVARIABLES" : 0,
				"NUMBEROFOUTGOINGMETHODS" : 7,
				"METHODRETURNTYPE" : "void",
				"METHODOVERRIDE" : [ ],
				"OUTGOINGMETHOD" : [ {
					"CALLEECLASS" : "LoginBean",
					"CALLEEMETHODNAME" : "fireLoginEvent"
				} ],
				"NUMBEROFMETHODLINES" : 2,
				"METHODPARAMETER" : [ {
					"PARAMETERNAME" : "event",
					"PARAMETERTYPE" : "ActionEvent"
				} ]
			} ]
		},
		"MySubject" : {
			"FIELDDETAIL" : [ {
				"FIELDCOMMONTYPE" : "ArrayList",
				"FIELDMODIFIERTYPE" : [ "protected" ],
				"FIELDDECLARATION" : [ "observers = new ArrayList()" ],
				"FIELDDATATYPE" : "ArrayList",
				"FIELDACCESSSPECIFIER" : "PROTECTED"
			} ],
			"CLASSORINTERFACEDETAIL" : [ {
				"CLASSACCESSSPECIFIER" : "PUBLIC",
				"NUMBEROFMETHODCALLS" : 2,
				"EXTENDSFROM" : [ ],
				"IMPLEMENTSFROM" : [ ],
				"CLASSNAME" : "MySubject",
				"ISINTERFACEORNOT" : false,
				"CLASSTYPEPARAMS" : [ ],
				"ISABSTRACTORNOT" : true,
				"CLASSMODIFIERTYPE" : [ "public", "abstract" ]
			} ],
			"CONSTRUCTORDETAIL" : [ ],
			"VARIABLEDETAIL" : [ ],
			"METHODDETAIL" : [ {
				"METHODNAME" : "attach",
				"NUMBEROFINCOMINGMETHODS" : 0,
				"INCOMINGMETHOD" : [ ],
				"METHODMODIFIERTYPE" : [ "public" ],
				"METHODBODYLINETYPE" : [ "EXPRESSION" ],
				"NUMBEROFMETHODVARIABLES" : 0,
				"NUMBEROFOUTGOINGMETHODS" : 1,
				"METHODRETURNTYPE" : "void",
				"METHODOVERRIDE" : [ ],
				"OUTGOINGMETHOD" : [ ],
				"NUMBEROFMETHODLINES" : 1,
				"METHODPARAMETER" : [ {
					"PARAMETERNAME" : "observer",
					"PARAMETERTYPE" : "MyObserver"
				} ]
			}, {
				"METHODNAME" : "detach",
				"NUMBEROFINCOMINGMETHODS" : 0,
				"INCOMINGMETHOD" : [ ],
				"METHODMODIFIERTYPE" : [ "public" ],
				"METHODBODYLINETYPE" : [ "EXPRESSION" ],
				"NUMBEROFMETHODVARIABLES" : 0,
				"NUMBEROFOUTGOINGMETHODS" : 1,
				"METHODRETURNTYPE" : "void",
				"METHODOVERRIDE" : [ ],
				"OUTGOINGMETHOD" : [ ],
				"NUMBEROFMETHODLINES" : 1,
				"METHODPARAMETER" : [ {
					"PARAMETERNAME" : "observer",
					"PARAMETERTYPE" : "MyObserver"
				} ]
			}, {
				"METHODNAME" : "cry",
				"NUMBEROFINCOMINGMETHODS" : 0,
				"INCOMINGMETHOD" : [ ],
				"METHODMODIFIERTYPE" : [ "public", "abstract" ],
				"METHODBODYLINETYPE" : [ ],
				"NUMBEROFMETHODVARIABLES" : 0,
				"NUMBEROFOUTGOINGMETHODS" : 0,
				"METHODRETURNTYPE" : "void",
				"METHODOVERRIDE" : [ ],
				"OUTGOINGMETHOD" : [ ],
				"NUMBEROFMETHODLINES" : 0,
				"METHODPARAMETER" : [ ]
			} ]
		},
		"Cat" : {
			"FIELDDETAIL" : [ ],
			"CLASSORINTERFACEDETAIL" : [ {
				"CLASSACCESSSPECIFIER" : "PUBLIC",
				"NUMBEROFMETHODCALLS" : 3,
				"EXTENDSFROM" : [ "MySubject" ],
				"IMPLEMENTSFROM" : [ ],
				"CLASSNAME" : "Cat",
				"ISINTERFACEORNOT" : false,
				"CLASSTYPEPARAMS" : [ ],
				"ISABSTRACTORNOT" : false,
				"CLASSMODIFIERTYPE" : [ "public" ]
			} ],
			"CONSTRUCTORDETAIL" : [ ],
			"VARIABLEDETAIL" : [ {
				"VARIABLEDECLARATION" : [ "obs" ],
				"VARIABLECOMMONTYPE" : "Object",
				"VARIABLEELEMENTTYPE" : "Object"
			} ],
			"METHODDETAIL" : [ {
				"METHODNAME" : "cry",
				"NUMBEROFINCOMINGMETHODS" : 0,
				"INCOMINGMETHOD" : [ ],
				"METHODMODIFIERTYPE" : [ "public" ],
				"METHODBODYLINETYPE" : [ "EXPRESSION", "EXPRESSION", "LOOP" ],
				"NUMBEROFMETHODVARIABLES" : 0,
				"NUMBEROFOUTGOINGMETHODS" : 3,
				"METHODRETURNTYPE" : "void",
				"METHODOVERRIDE" : [ ],
				"OUTGOINGMETHOD" : [ ],
				"NUMBEROFMETHODLINES" : 3,
				"METHODPARAMETER" : [ ]
			} ]
		},
		"LoginEvent" : {
			"FIELDDETAIL" : [ {
				"FIELDCOMMONTYPE" : "String",
				"FIELDMODIFIERTYPE" : [ "private" ],
				"FIELDDECLARATION" : [ "userName" ],
				"FIELDDATATYPE" : "String",
				"FIELDACCESSSPECIFIER" : "PRIVATE"
			}, {
				"FIELDCOMMONTYPE" : "String",
				"FIELDMODIFIERTYPE" : [ "private" ],
				"FIELDDECLARATION" : [ "password" ],
				"FIELDDATATYPE" : "String",
				"FIELDACCESSSPECIFIER" : "PRIVATE"
			} ],
			"CLASSORINTERFACEDETAIL" : [ {
				"CLASSACCESSSPECIFIER" : "PUBLIC",
				"NUMBEROFMETHODCALLS" : 0,
				"EXTENDSFROM" : [ "EventObject" ],
				"IMPLEMENTSFROM" : [ ],
				"CLASSNAME" : "LoginEvent",
				"ISINTERFACEORNOT" : false,
				"CLASSTYPEPARAMS" : [ ],
				"ISABSTRACTORNOT" : false,
				"CLASSMODIFIERTYPE" : [ "public" ]
			} ],
			"CONSTRUCTORDETAIL" : [ {
				"CONSTRUCTORMODIFIER" : [ "public" ],
				"CONSTRUCTORPARAMETER" : [ {
					"PARAMETERNAME" : "source",
					"PARAMETERTYPE" : "Object"
				}, {
					"PARAMETERNAME" : "userName",
					"PARAMETERTYPE" : "String"
				}, {
					"PARAMETERNAME" : "password",
					"PARAMETERTYPE" : "String"
				} ]
			} ],
			"VARIABLEDETAIL" : [ ],
			"METHODDETAIL" : [ {
				"METHODNAME" : "setUserName",
				"NUMBEROFINCOMINGMETHODS" : 0,
				"INCOMINGMETHOD" : [ ],
				"METHODMODIFIERTYPE" : [ "public" ],
				"METHODBODYLINETYPE" : [ "EXPRESSION" ],
				"NUMBEROFMETHODVARIABLES" : 0,
				"NUMBEROFOUTGOINGMETHODS" : 0,
				"METHODRETURNTYPE" : "void",
				"METHODOVERRIDE" : [ ],
				"OUTGOINGMETHOD" : [ ],
				"NUMBEROFMETHODLINES" : 1,
				"METHODPARAMETER" : [ {
					"PARAMETERNAME" : "userName",
					"PARAMETERTYPE" : "String"
				} ]
			}, {
				"METHODNAME" : "getUserName",
				"NUMBEROFINCOMINGMETHODS" : 0,
				"INCOMINGMETHOD" : [ ],
				"METHODMODIFIERTYPE" : [ "public" ],
				"METHODBODYLINETYPE" : [ "RETURN" ],
				"NUMBEROFMETHODVARIABLES" : 0,
				"NUMBEROFOUTGOINGMETHODS" : 0,
				"METHODRETURNTYPE" : "String",
				"METHODOVERRIDE" : [ ],
				"OUTGOINGMETHOD" : [ ],
				"NUMBEROFMETHODLINES" : 1,
				"METHODPARAMETER" : [ ]
			}, {
				"METHODNAME" : "setPassword",
				"NUMBEROFINCOMINGMETHODS" : 0,
				"INCOMINGMETHOD" : [ ],
				"METHODMODIFIERTYPE" : [ "public" ],
				"METHODBODYLINETYPE" : [ "EXPRESSION" ],
				"NUMBEROFMETHODVARIABLES" : 0,
				"NUMBEROFOUTGOINGMETHODS" : 0,
				"METHODRETURNTYPE" : "void",
				"METHODOVERRIDE" : [ ],
				"OUTGOINGMETHOD" : [ ],
				"NUMBEROFMETHODLINES" : 1,
				"METHODPARAMETER" : [ {
					"PARAMETERNAME" : "password",
					"PARAMETERTYPE" : "String"
				} ]
			}, {
				"METHODNAME" : "getPassword",
				"NUMBEROFINCOMINGMETHODS" : 0,
				"INCOMINGMETHOD" : [ ],
				"METHODMODIFIERTYPE" : [ "public" ],
				"METHODBODYLINETYPE" : [ "RETURN" ],
				"NUMBEROFMETHODVARIABLES" : 0,
				"NUMBEROFOUTGOINGMETHODS" : 0,
				"METHODRETURNTYPE" : "String",
				"METHODOVERRIDE" : [ ],
				"OUTGOINGMETHOD" : [ ],
				"NUMBEROFMETHODLINES" : 1,
				"METHODPARAMETER" : [ ]
			} ]
		},
		"LoginValidatorA" : {
			"FIELDDETAIL" : [ {
				"FIELDCOMMONTYPE" : "JPanel",
				"FIELDMODIFIERTYPE" : [ "private" ],
				"FIELDDECLARATION" : [ "p" ],
				"FIELDDATATYPE" : "JPanel",
				"FIELDACCESSSPECIFIER" : "PRIVATE"
			}, {
				"FIELDCOMMONTYPE" : "LoginBean",
				"FIELDMODIFIERTYPE" : [ "private" ],
				"FIELDDECLARATION" : [ "lb" ],
				"FIELDDATATYPE" : "LoginBean",
				"FIELDACCESSSPECIFIER" : "PRIVATE"
			}, {
				"FIELDCOMMONTYPE" : "JLabel",
				"FIELDMODIFIERTYPE" : [ "private" ],
				"FIELDDECLARATION" : [ "lblLogo" ],
				"FIELDDATATYPE" : "JLabel",
				"FIELDACCESSSPECIFIER" : "PRIVATE"
			} ],
			"CLASSORINTERFACEDETAIL" : [ {
				"CLASSACCESSSPECIFIER" : "PUBLIC",
				"NUMBEROFMETHODCALLS" : 20,
				"EXTENDSFROM" : [ "JFrame", "LoginEventListener" ],
				"IMPLEMENTSFROM" : [ "LoginEventListener" ],
				"CLASSNAME" : "LoginValidatorA",
				"ISINTERFACEORNOT" : false,
				"CLASSTYPEPARAMS" : [ ],
				"ISABSTRACTORNOT" : false,
				"CLASSMODIFIERTYPE" : [ "public" ]
			} ],
			"CONSTRUCTORDETAIL" : [ {
				"CONSTRUCTORMODIFIER" : [ "public" ],
				"CONSTRUCTORPARAMETER" : [ ]
			} ],
			"VARIABLEDETAIL" : [ {
				"VARIABLEDECLARATION" : [ "f = new Font(\"Times New Roman\", Font.BOLD, 30)" ],
				"VARIABLECOMMONTYPE" : "Font",
				"VARIABLEELEMENTTYPE" : "Font"
			}, {
				"VARIABLEDECLARATION" : [ "userName = event.getUserName()" ],
				"VARIABLECOMMONTYPE" : "String",
				"VARIABLEELEMENTTYPE" : "String"
			}, {
				"VARIABLEDECLARATION" : [ "password = event.getPassword()" ],
				"VARIABLECOMMONTYPE" : "String",
				"VARIABLEELEMENTTYPE" : "String"
			} ],
			"METHODDETAIL" : [ {
				"METHODNAME" : "validateLogin",
				"NUMBEROFINCOMINGMETHODS" : 0,
				"INCOMINGMETHOD" : [ ],
				"METHODMODIFIERTYPE" : [ "public" ],
				"METHODBODYLINETYPE" : [ "EXPRESSION", "EXPRESSION", "IF" ],
				"NUMBEROFMETHODVARIABLES" : 2,
				"NUMBEROFOUTGOINGMETHODS" : 8,
				"METHODRETURNTYPE" : "void",
				"METHODOVERRIDE" : [ ],
				"OUTGOINGMETHOD" : [ ],
				"NUMBEROFMETHODLINES" : 3,
				"METHODPARAMETER" : [ {
					"PARAMETERNAME" : "event",
					"PARAMETERTYPE" : "LoginEvent"
				} ]
			}, {
				"METHODNAME" : "main",
				"NUMBEROFINCOMINGMETHODS" : 0,
				"INCOMINGMETHOD" : [ ],
				"METHODMODIFIERTYPE" : [ "public", "static" ],
				"METHODBODYLINETYPE" : [ "EXPRESSION" ],
				"NUMBEROFMETHODVARIABLES" : 0,
				"NUMBEROFOUTGOINGMETHODS" : 1,
				"METHODRETURNTYPE" : "void",
				"METHODOVERRIDE" : [ ],
				"OUTGOINGMETHOD" : [ ],
				"NUMBEROFMETHODLINES" : 1,
				"METHODPARAMETER" : [ {
					"PARAMETERNAME" : "args",
					"PARAMETERTYPE" : "String[]"
				} ]
			} ]
		},
		"LoginValidatorB" : {
			"FIELDDETAIL" : [ {
				"FIELDCOMMONTYPE" : "JPanel",
				"FIELDMODIFIERTYPE" : [ "private" ],
				"FIELDDECLARATION" : [ "p" ],
				"FIELDDATATYPE" : "JPanel",
				"FIELDACCESSSPECIFIER" : "PRIVATE"
			}, {
				"FIELDCOMMONTYPE" : "LoginBean",
				"FIELDMODIFIERTYPE" : [ "private" ],
				"FIELDDECLARATION" : [ "lb" ],
				"FIELDDATATYPE" : "LoginBean",
				"FIELDACCESSSPECIFIER" : "PRIVATE"
			}, {
				"FIELDCOMMONTYPE" : "JLabel",
				"FIELDMODIFIERTYPE" : [ "private" ],
				"FIELDDECLARATION" : [ "lblLogo" ],
				"FIELDDATATYPE" : "JLabel",
				"FIELDACCESSSPECIFIER" : "PRIVATE"
			} ],
			"CLASSORINTERFACEDETAIL" : [ {
				"CLASSACCESSSPECIFIER" : "PUBLIC",
				"NUMBEROFMETHODCALLS" : 17,
				"EXTENDSFROM" : [ "JFrame", "LoginEventListener" ],
				"IMPLEMENTSFROM" : [ "LoginEventListener" ],
				"CLASSNAME" : "LoginValidatorB",
				"ISINTERFACEORNOT" : false,
				"CLASSTYPEPARAMS" : [ ],
				"ISABSTRACTORNOT" : false,
				"CLASSMODIFIERTYPE" : [ "public" ]
			} ],
			"CONSTRUCTORDETAIL" : [ {
				"CONSTRUCTORMODIFIER" : [ "public" ],
				"CONSTRUCTORPARAMETER" : [ ]
			} ],
			"VARIABLEDETAIL" : [ {
				"VARIABLEDECLARATION" : [ "f = new Font(\"Times New Roman\", Font.BOLD, 30)" ],
				"VARIABLECOMMONTYPE" : "Font",
				"VARIABLEELEMENTTYPE" : "Font"
			}, {
				"VARIABLEDECLARATION" : [ "userName = event.getUserName()" ],
				"VARIABLECOMMONTYPE" : "String",
				"VARIABLEELEMENTTYPE" : "String"
			}, {
				"VARIABLEDECLARATION" : [ "password = event.getPassword()" ],
				"VARIABLECOMMONTYPE" : "String",
				"VARIABLEELEMENTTYPE" : "String"
			} ],
			"METHODDETAIL" : [ {
				"METHODNAME" : "validateLogin",
				"NUMBEROFINCOMINGMETHODS" : 0,
				"INCOMINGMETHOD" : [ ],
				"METHODMODIFIERTYPE" : [ "public" ],
				"METHODBODYLINETYPE" : [ "EXPRESSION", "EXPRESSION", "IF" ],
				"NUMBEROFMETHODVARIABLES" : 2,
				"NUMBEROFOUTGOINGMETHODS" : 5,
				"METHODRETURNTYPE" : "void",
				"METHODOVERRIDE" : [ ],
				"OUTGOINGMETHOD" : [ ],
				"NUMBEROFMETHODLINES" : 3,
				"METHODPARAMETER" : [ {
					"PARAMETERNAME" : "event",
					"PARAMETERTYPE" : "LoginEvent"
				} ]
			}, {
				"METHODNAME" : "main",
				"NUMBEROFINCOMINGMETHODS" : 0,
				"INCOMINGMETHOD" : [ ],
				"METHODMODIFIERTYPE" : [ "public", "static" ],
				"METHODBODYLINETYPE" : [ "EXPRESSION" ],
				"NUMBEROFMETHODVARIABLES" : 0,
				"NUMBEROFOUTGOINGMETHODS" : 1,
				"METHODRETURNTYPE" : "void",
				"METHODOVERRIDE" : [ ],
				"OUTGOINGMETHOD" : [ ],
				"NUMBEROFMETHODLINES" : 1,
				"METHODPARAMETER" : [ {
					"PARAMETERNAME" : "args",
					"PARAMETERTYPE" : "String[]"
				} ]
			} ]
		},
		"Client" : {
			"FIELDDETAIL" : [ ],
			"CLASSORINTERFACEDETAIL" : [ {
				"CLASSACCESSSPECIFIER" : "PUBLIC",
				"NUMBEROFMETHODCALLS" : 5,
				"EXTENDSFROM" : [ ],
				"IMPLEMENTSFROM" : [ ],
				"CLASSNAME" : "Client",
				"ISINTERFACEORNOT" : false,
				"CLASSTYPEPARAMS" : [ ],
				"ISABSTRACTORNOT" : false,
				"CLASSMODIFIERTYPE" : [ "public" ]
			} ],
			"CONSTRUCTORDETAIL" : [ ],
			"VARIABLEDETAIL" : [ {
				"VARIABLEDECLARATION" : [ "subject = new Cat()" ],
				"VARIABLECOMMONTYPE" : "MySubject",
				"VARIABLEELEMENTTYPE" : "MySubject"
			}, {
				"VARIABLEDECLARATION" : [ "obs1", "obs2", "obs3" ],
				"VARIABLECOMMONTYPE" : "MyObserver",
				"VARIABLEELEMENTTYPE" : "MyObserver"
			}, {
				"VARIABLEDECLARATION" : [ "obs4" ],
				"VARIABLECOMMONTYPE" : "MyObserver",
				"VARIABLEELEMENTTYPE" : "MyObserver"
			} ],
			"METHODDETAIL" : [ {
				"METHODNAME" : "main",
				"NUMBEROFINCOMINGMETHODS" : 0,
				"INCOMINGMETHOD" : [ ],
				"METHODMODIFIERTYPE" : [ "public", "static" ],
				"METHODBODYLINETYPE" : [ "EXPRESSION", "EXPRESSION", "EXPRESSION", "EXPRESSION", "EXPRESSION", "EXPRESSION", "EXPRESSION", "EXPRESSION", "EXPRESSION", "EXPRESSION", "EXPRESSION", "EXPRESSION" ],
				"NUMBEROFMETHODVARIABLES" : 5,
				"NUMBEROFOUTGOINGMETHODS" : 5,
				"METHODRETURNTYPE" : "void",
				"METHODOVERRIDE" : [ ],
				"OUTGOINGMETHOD" : [ ],
				"NUMBEROFMETHODLINES" : 12,
				"METHODPARAMETER" : [ {
					"PARAMETERNAME" : "a",
					"PARAMETERTYPE" : "String[]"
				} ]
			} ]
		},
		"Dog" : {
			"FIELDDETAIL" : [ ],
			"CLASSORINTERFACEDETAIL" : [ {
				"CLASSACCESSSPECIFIER" : "PUBLIC",
				"NUMBEROFMETHODCALLS" : 1,
				"EXTENDSFROM" : [ ],
				"IMPLEMENTSFROM" : [ "MyObserver" ],
				"CLASSNAME" : "Dog",
				"ISINTERFACEORNOT" : false,
				"CLASSTYPEPARAMS" : [ ],
				"ISABSTRACTORNOT" : false,
				"CLASSMODIFIERTYPE" : [ "public" ]
			} ],
			"CONSTRUCTORDETAIL" : [ ],
			"VARIABLEDETAIL" : [ ],
			"METHODDETAIL" : [ {
				"METHODNAME" : "response",
				"NUMBEROFINCOMINGMETHODS" : 0,
				"INCOMINGMETHOD" : [ ],
				"METHODMODIFIERTYPE" : [ "public" ],
				"METHODBODYLINETYPE" : [ "EXPRESSION" ],
				"NUMBEROFMETHODVARIABLES" : 0,
				"NUMBEROFOUTGOINGMETHODS" : 1,
				"METHODRETURNTYPE" : "void",
				"METHODOVERRIDE" : [ ],
				"OUTGOINGMETHOD" : [ ],
				"NUMBEROFMETHODLINES" : 1,
				"METHODPARAMETER" : [ ]
			} ]
		},
		"Pig" : {
			"FIELDDETAIL" : [ ],
			"CLASSORINTERFACEDETAIL" : [ {
				"CLASSACCESSSPECIFIER" : "PUBLIC",
				"NUMBEROFMETHODCALLS" : 1,
				"EXTENDSFROM" : [ ],
				"IMPLEMENTSFROM" : [ "MyObserver" ],
				"CLASSNAME" : "Pig",
				"ISINTERFACEORNOT" : false,
				"CLASSTYPEPARAMS" : [ ],
				"ISABSTRACTORNOT" : false,
				"CLASSMODIFIERTYPE" : [ "public" ]
			} ],
			"CONSTRUCTORDETAIL" : [ ],
			"VARIABLEDETAIL" : [ ],
			"METHODDETAIL" : [ {
				"METHODNAME" : "response",
				"NUMBEROFINCOMINGMETHODS" : 0,
				"INCOMINGMETHOD" : [ ],
				"METHODMODIFIERTYPE" : [ "public" ],
				"METHODBODYLINETYPE" : [ "EXPRESSION" ],
				"NUMBEROFMETHODVARIABLES" : 0,
				"NUMBEROFOUTGOINGMETHODS" : 1,
				"METHODRETURNTYPE" : "void",
				"METHODOVERRIDE" : [ ],
				"OUTGOINGMETHOD" : [ ],
				"NUMBEROFMETHODLINES" : 1,
				"METHODPARAMETER" : [ ]
			} ]
		}
	},
	"summary_NLG" : {
		"observer" : {
			"LoginEventListener" : [ "LoginEventListener acts as an observer for publisher LoginBean, which is inherited by LoginValidatorA, LoginValidatorB, which validates LoginEvent parameter of event Login." ],
			"LoginBean" : [ "LoginBean acts as a publisher for observer LoginEventListener, which is inherited by, which adds LoginEventListener parameter of lel Login Event Listener, which fires Object parameter of object, String parameter of userName, String parameter of password Login Event, which actions ActionEvent parameter of event Performed." ],
			"LoginValidatorA" : [ "LoginValidatorA acts as an observer, which validates LoginEvent parameter of event Login, which mains String[] parameter of args." ],
			"LoginValidatorB" : [ "LoginValidatorB acts as an observer, which validates LoginEvent parameter of event Login, which mains String[] parameter of args." ]
		},
		"adapter" : {
			"LoginEventListener" : [ "LoginEventListener acts as a target for adapter LoginValidatorA, which adapts to LoginEventListener.", "LoginEventListener acts as a target for adapter LoginValidatorB, which adapts to LoginEventListener." ],
			"LoginBean" : [ "LoginBean acts as an adaptee for adapter LoginValidatorB, which adapts to LoginEventListener, which adapts to LoginEventListener, which adapts to LoginEventListener.", "LoginBean acts as an adaptee for adapter LoginValidatorA, which adapts to LoginEventListener, which adapts to LoginEventListener, which adapts to LoginEventListener." ],
			"LoginValidatorA" : [ "LoginValidatorA acts as an adapter, which adapts to LoginEventListener, which adapts to LoginEventListener." ],
			"LoginValidatorB" : [ "LoginValidatorB acts as an adapter, which adapts to LoginEventListener, which adapts to LoginEventListener." ]
		}
	}
}